Symbol,Name,Last Sale,Net Change,% Change,Market Cap,Country,IPO Year,Volume,Sector,Industry
PSA,Public Storage Common Stock,$340.94,7.70,2.311%,59670781820.00,United States,,538147,Real Estate,Real Estate Investment Trusts
PSA^F,Public Storage Depositary Shares Each Representing 1/1000 of a 5.15% Cumulative Preferred Share of Beneficial Interest Series F par value $0.01 per share,$24.34,0.08,0.33%,,United States,,27910,,
PSA^G,Public Storage Depositary Shares Each Representing 1/1000 of a 5.05% Cumulative Preferred Share of Beneficial Interest Series G,$23.85,0.15,0.633%,,United States,,10376,,
PSA^H,Public Storage Depositary Shares Each Representing 1/1000 of a  5.60% Cumulative Preferred  Share of Beneficial Interest Series H,$25.33,0.13,0.516%,,United States,,7078,,
PSA^I,Public Storage Depositary Shares Each Representing 1/1000 of a 4.875% Cumulative Preferred Share of Beneficial Interest Series I par value $0.01 per share,$22.89,0.00,0.00%,,United States,,11256,,
PSA^J,Public Storage Depositary Shares Each Representing 1/1000 of a 4.700% Cumulative Preferred Share of Beneficial Interest Series J par value $0.01 per share,$21.815,0.065,0.299%,,United States,,17055,,
PSA^K,Public Storage Depositary Shares Each Representing 1/1000 of a 4.75% Cumulative Preferred Share of Beneficial Interest Series K,$21.9821,0.0121,0.055%,,United States,,15727,,
PSA^L,Public Storage Depositary Shares Each Representing 1/1000 of a 4.625% Cumulative Preferred Share of Beneficial Interest Series L par value $0.01 per share,$21.30,-0.05,-0.234%,,United States,,53517,,
PSA^M,Public Storage Depositary Shares Each Representing 1/1000 of a 4.125% Cumulative Preferred Share of Beneficial Interest Series M,$19.45,-0.045,-0.231%,,United States,,14712,,
PSA^N,Public Storage Depositary Shares Each Representing 1/1000 of a 3.875% Cumulative Preferred Share of Beneficial Interest Series N,$18.11,0.09,0.499%,,United States,,11500,,
PSA^O,Public Storage Depositary Shares Each Representing 1/1000 of a 3.900% Cumulative Preferred Share of Beneficial Interest Series O,$18.14,0.0617,0.341%,,United States,,19186,,
PSA^P,Public Storage Depositary Shares Each Representing 1/1000 of a 4.000% Cumulative Preferred Share of Bene cial Interest Series P,$18.60,0.06,0.324%,,United States,,15870,,
PSA^Q,Public Storage Depositary Shares Each Representing 1/1000 of a 3.950% Cumulative Preferred Share of Beneficial Interest Series Q par value $0.01 per share,$18.43,0.055,0.299%,,United States,,3419,,
PSA^R,Public Storage Depositary Shares Each Representing 1/1000 of a 4.00% Cumulative Preferred Share of Bene cial Interest Series R,$18.65,0.04,0.215%,,United States,,79681,,
PSA^S,Public Storage Depositary Shares Each Representing 1/1000 of a 4.100% Cumulative Preferred Share of Beneficial Interest Series S,$19.23,-0.02,-0.104%,,United States,,10928,,
PSBD,Palmer Square Capital BDC Inc. Common Stock,$16.27,0.06,0.37%,0.00,,2024,3391,,
PSEC,Prospect Capital Corporation Common Stock,$5.08,0.00,0.00%,2122209060.00,United States,2004,2226759,Finance,Finance: Consumer Services
PSEC^A,Prospect Capital Corporation 5.35% Series A Fixed Rate Cumulative Perpetual Preferred Stock,$19.1682,-0.472,-2.403%,,United States,,17572,,
PSF,Cohen & Steers Select Preferred and Income Fund Inc. Common Stock,$20.14,0.10,0.499%,989651968.00,,2010,23365,Finance,Investment Managers
PSFE,Paysafe Limited Common Shares,$21.92,0.32,1.481%,1352890191.00,,2021,289553,Consumer Discretionary,Business Services
PSHG,Performance Shipping Inc. Common Shares,$1.97,-0.03,-1.50%,24190962.00,Greece,,33578,Consumer Discretionary,Marine Transportation
PSIG,PS International Group Ltd. Ordinary Shares,$0.97,-0.01,-1.02%,23554449.00,Hong Kong,,176210,Consumer Discretionary,Oil Refining/Marketing
PSMT,PriceSmart Inc. Common Stock,$89.30,3.08,3.572%,2736062075.00,United States,,144322,Consumer Discretionary,Department/Specialty Retail Stores
PSN,Parsons Corporation Common Stock,$94.61,-0.14,-0.148%,10046175339.00,United States,2019,737357,Technology,EDP Services
PSNL,Personalis Inc. Common Stock,$5.97,0.26,4.553%,316855947.00,United States,2019,1260495,Health Care,Medical Specialities
PSNY,Polestar Automotive Holding UK PLC Class A ADS,$0.8897,0.0627,7.582%,1899696593.00,Sweden,,23160628,Consumer Discretionary,Auto Manufacturing
PSNYW,Polestar Automotive Holding UK PLC Class C-1 ADS (ADW),$0.1319,0.0009,0.687%,281634237.00,Sweden,,121143,Consumer Discretionary,Auto Manufacturing
PSO,Pearson Plc Common Stock,$13.75,0.18,1.326%,9179407188.00,United Kingdom,,307257,Consumer Discretionary,Books
PSQH,PSQ Holdings Inc. Class A Common Stock,$2.84,0.00,0.00%,89152130.00,,2021,42178,Consumer Discretionary,Advertising
PSTG,Pure Storage Inc. Class A Common Stock,$61.56,0.61,1.001%,20021433234.00,United States,2015,2380930,Technology,Electronic Components
PSTL,Postal Realty Trust Inc. Class A Common Stock,$14.36,0.24,1.70%,330758561.00,United States,2019,102055,Real Estate,Real Estate Investment Trusts
PSTV,PLUS THERAPEUTICS Inc. Common Stock ,$1.445,0.015,1.049%,8520201.00,United States,,14354,Health Care,Medical/Dental Instruments
PSTX,Poseida Therapeutics Inc. Common Stock,$2.86,0.06,2.143%,277763701.00,United States,2020,254808,Health Care,Biotechnology: Biological Products (No Diagnostic Substances)
PSX,Phillips 66 Common Stock,$135.37,2.21,1.66%,56661710303.00,United States,,1910708,Energy,Integrated oil Companies
PT,Pintec Technology Holdings Limited American Depositary Shares,$1.02,-0.01,-0.971%,16266920.00,China,2018,577,Technology,Computer Software: Programming Data Processing
PTA,Cohen & Steers Tax-Advantaged Preferred Securities and Income Fund Common Shares of Beneficial Interest,$20.23,0.10,0.497%,1118182035.00,United States,2020,100581,Finance,Trusts Except Educational Religious and Charitable
PTC,PTC Inc. Common Stock,$177.31,2.34,1.337%,21301177809.00,United States,,765818,Technology,Computer Software: Prepackaged Software
PTCT,PTC Therapeutics Inc. Common Stock,$34.15,0.72,2.154%,2626960406.00,United States,2013,431410,Health Care,Biotechnology: Pharmaceutical Preparations
PTEN,Patterson-UTI Energy Inc. Common Stock,$9.31,0.29,3.215%,3659293685.00,United States,1993,7870422,Energy,Oil & Gas Production
PTGX,Protagonist Therapeutics Inc. Common Stock,$41.68,0.24,0.579%,2455143103.00,United States,2016,698037,Health Care,Biotechnology: Pharmaceutical Preparations
PTIX,Protagenic Therapeutics Inc. Common Stock,$0.6496,0.017,2.687%,2901936.00,United States,,1666,Health Care,Biotechnology: Pharmaceutical Preparations
PTLO,Portillo's Inc. Class A Common Stock,$12.27,0.16,1.321%,758220012.00,United States,2021,799100,Consumer Discretionary,Restaurants
PTMN,Portman Ridge Finance Corporation Common Stock,$18.69,-0.04,-0.214%,172770809.00,United States,2006,79515,Finance,Finance: Consumer Services
PTN,Palatin Technologies Inc. Common Stock,$1.54,0.06,4.054%,24850426.00,United States,1999,99346,Health Care,Biotechnology: Pharmaceutical Preparations
PTON,Peloton Interactive Inc. Class A Common Stock,$4.84,0.29,6.374%,1794741502.00,United States,2019,80328545,Consumer Discretionary,Recreational Games/Products/Toys
PTPI,Petros Pharmaceuticals Inc. Common Stock,$0.345,0.0002,0.058%,3314304.00,United States,,100608,Health Care,Biotechnology: Pharmaceutical Preparations
PTSI,P.A.M. Transportation Services Inc. Common Stock,$18.74,1.86,11.019%,407688906.00,United States,1986,20053,Industrials,Trucking Freight/Courier Services
PTVE,Pactiv Evergreen Inc. Common stock,$11.52,-0.06,-0.518%,2065013418.00,United States,2020,1318233,Consumer Discretionary,Containers/Packaging
PTWO,Pono Capital Two Inc. Class A Common Stock,$13.00,1.95,17.647%,0.00,United States,2022,209383,Finance,Blank Checks
PTWOU,Pono Capital Two Inc. Unit,$14.00,2.40,20.69%,0.00,United States,2022,11977,Finance,Blank Checks
PTWOW,Pono Capital Two Inc. Warrants,$0.09,0.02,28.571%,0.00,United States,2022,292920,Finance,Blank Checks
PTY,Pimco Corporate & Income Opportunity Fund,$14.21,0.01,0.07%,0.00,United States,2002,593191,Finance,Investment Managers
PUBM,PubMatic Inc. Class A Common Stock,$15.95,0.63,4.112%,790866570.00,United States,2020,672673,Technology,Computer Software: Programming Data Processing
PUK,Prudential Public Limited Company Common Stock,$17.90,0.48,2.755%,24414151550.00,United Kingdom,,668514,Finance,Life Insurance
PULM,Pulmatrix Inc. Common Stock,$2.00,-0.05,-2.439%,7304570.00,United States,2014,7779,Health Care,Biotechnology: Pharmaceutical Preparations
PUMP,ProPetro Holding Corp. Common Stock,$8.10,0.23,2.922%,843713634.00,United States,2017,1355838,Energy,Oilfield Services/Equipment
PVBC,Provident Bancorp Inc. (MD) Common Stock,$10.67,0.34,3.291%,188510379.00,United States,2015,35538,Finance,Banks
PVH,PVH Corp. Common Stock,$105.66,3.79,3.72%,5901933774.00,United States,,666704,Consumer Discretionary,Apparel
PVL,Permianville Royalty Trust Trust Units ,$1.84,-0.03,-1.604%,60720000.00,United States,2011,96697,Energy,Oil & Gas Production
PW,Power REIT (MD) Common Stock,$1.59,0.07,4.605%,5389561.00,United States,1998,192281,Real Estate,Real Estate Investment Trusts
PW^A,Power REIT 7.75% Series A Cumulative Perpetual Preferred Stock,$3.16,-0.03,-0.94%,,United States,,932,,
PWM,Prestige Wealth Inc. Class A Ordinary Shares,$0.754,-0.0224,-2.885%,6899100.00,Hong Kong,2023,3957439,Finance,Finance: Consumer Services
PWOD,Penns Woods Bancorp Inc. Common Stock,$22.02,0.60,2.801%,166130573.00,United States,,25851,Finance,Major Banks
PWP,Perella Weinberg Partners Class A Common Stock,$20.01,0.54,2.773%,1717642752.00,United States,2020,471956,Finance,Finance: Consumer Services
PWR,Quanta Services Inc. Common Stock,$273.17,5.37,2.005%,40246075729.00,United States,,503596,Industrials,Engineering & Construction
PWSC,PowerSchool Holdings Inc. Class A Common Stock,$22.67,0.01,0.044%,4628763842.00,United States,2021,745870,Technology,Computer Software: Prepackaged Software
PWUP,PowerUp Acquisition Corp. Class A Ordinary Shares,$11.23,0.00,0.00%,0.00,United States,2022,5,Finance,Blank Checks
PWUPU,PowerUp Acquisition Corp. Unit,$11.11,0.00,0.00%,0.00,United States,2022,7,Finance,Blank Checks
PWUPW,PowerUp Acquisition Corp. Warrant,$0.05,-0.0074,-12.892%,0.00,United States,2022,29482,Finance,Blank Checks
PX,P10 Inc. Class A Common Stock,$10.35,0.35,3.50%,1155876594.00,United States,2021,597471,Finance,Investment Managers
PXDT,Pixie Dust Technologies Inc. American Depositary Shares ,$1.31,-0.01,-0.758%,19259970.00,Japan,2023,2165,Health Care,Biotechnology: Electromedical & Electrotherapeutic Apparatus
PXLW,Pixelworks Inc.  Common Stock,$0.74,-0.011,-1.465%,43328246.00,United States,2000,522409,Technology,Semiconductors
PXS,Pyxis Tankers Inc. Common Stock,$5.2005,-0.0295,-0.564%,54826516.00,Greece,,8535,Consumer Discretionary,Marine Transportation
PXSAP,Pyxis Tankers Inc. 7.75% Series A Cumulative Convertible Preferred Shares,$24.80,0.07,0.283%,261455166.00,Greece,,503,Consumer Discretionary,Marine Transportation
PXSAW,Pyxis Tankers Inc. Warrant,$1.07,0.00,0.00%,11280525.00,Greece,,2,Consumer Discretionary,Marine Transportation
PYCR,Paycor HCM Inc. Common Stock,$14.26,0.27,1.93%,2541276482.00,United States,2021,619529,Technology,Computer Software: Prepackaged Software
PYN,PIMCO New York Municipal Income Fund III Common Shares of Beneficial Interest,$6.015,0.025,0.417%,0.00,United States,2002,11730,Finance,Investment Managers
PYPD,PolyPid Ltd. Ordinary Shares,$3.40,-0.06,-1.734%,5622101.00,Israel,2020,8056,Health Care,Medical/Dental Instruments
PYPL,PayPal Holdings Inc. Common Stock,$71.70,0.18,0.252%,73301304278.00,United States,,8213683,Consumer Discretionary,Business Services
PYT,PPlus Tr GSC-2 Tr Ctf Fltg Rate,$22.65,0.00,0.00%,0.00,United States,,80,Finance,Finance: Consumer Services
PYXS,Pyxis Oncology Inc. Common Stock,$3.71,0.06,1.644%,218675722.00,United States,2021,200849,Health Care,Biotechnology: Pharmaceutical Preparations
PZC,PIMCO California Municipal Income Fund III Common Shares of Beneficial Interest,$7.26,0.04,0.554%,0.00,United States,2002,23635,Finance,Investment Managers
PZG,Paramount Gold Nevada Corp. Common Stock,$0.4246,-0.0077,-1.781%,27016623.00,United States,2015,76358,Basic Materials,Metal Mining
PZZA,Papa John's International Inc. Common Stock,$45.93,0.85,1.886%,1498506944.00,United States,1993,786113,Consumer Discretionary,Restaurants
QBTS,D-Wave Quantum Inc. Common Shares,$1.07,0.00,0.00%,215529348.00,,2022,3483849,Technology,EDP Services
QCOM,QUALCOMM Incorporated Common Stock,$173.50,4.50,2.663%,193279000000.00,United States,1991,6819295,Technology,Radio And Television Broadcasting And Communications Equipment
QCRH,QCR Holdings Inc. Common Stock,$76.46,4.495,6.246%,1287733433.00,United States,,91556,Finance,Major Banks
QD,Qudian Inc. American Depositary Shares each representing one Class A Ordinary Share,$1.85,0.01,0.543%,350397124.00,China,2017,294941,Finance,Finance: Consumer Services
QDEL,QuidelOrtho Corporation Common Stock,$45.01,1.65,3.805%,3026265084.00,United States,,616065,Health Care,Biotechnology: In Vitro & In Vivo Diagnostic Substances
QETA,Quetta Acquisition Corporation Common Stock,$10.37,-0.01,-0.096%,0.00,United States,2023,183057,Finance,Blank Checks
QETAU,Quetta Acquisition Corporation Unit,$10.46,0.00,0.00%,0.00,United States,2023,2532,Finance,Blank Checks
QFIN,Qifu Technology Inc. American Depositary Shares,$25.02,-0.18,-0.714%,3884466965.00,China,2018,1644247,Finance,Finance: Consumer Services
QGEN,Qiagen N.V. Common Shares,$46.27,-0.45,-0.963%,10558941474.00,Netherlands,,2323783,Health Care,Biotechnology: Biological Products (No Diagnostic Substances)
QH,Quhuo Limited American Depository Shares,$0.3608,-0.0093,-2.513%,2225278.00,China,2020,28590,Consumer Discretionary,Business Services
QIPT,Quipt Home Medical Corp. Common Shares,$2.86,0.11,4.00%,121754556.00,United States,,257116,Health Care,Misc Health and Biotechnology Services
QLGN,Qualigen Therapeutics Inc. Common Stock,$0.2027,-0.007,-3.338%,2463987.00,United States,2015,228859,Health Care,Biotechnology: Pharmaceutical Preparations
QLYS,Qualys Inc. Common Stock,$125.06,2.37,1.932%,4603585911.00,United States,2012,342759,Technology,Computer Software: Prepackaged Software
QMCO,Quantum Corporation Common Stock,$0.2098,0.0064,3.147%,20109317.00,United States,,2607215,Technology,Electronic Components
QMMM,QMMM Holdings Limited Ordinary Shares,$4.75,-0.12,-2.464%,81343750.00,Hong Kong,2024,547200,Consumer Discretionary,Advertising
QNCX,Quince Therapeutics Inc. Common Stock,$0.66,0.019,2.964%,28562560.00,United States,2019,294221,Health Care,Biotechnology: Biological Products (No Diagnostic Substances)
QNRX,Quoin Pharmaceuticals Ltd. American Depositary Shares,$0.6047,-0.0053,-0.869%,2406688.00,Israel,2016,53920,Health Care,Medical/Dental Instruments
QNST,QuinStreet Inc. Common Stock,$17.96,0.87,5.091%,992771382.00,United States,2010,235264,Consumer Discretionary,Business Services
QNTM,Quantum Biopharma Ltd. Class B Subordinate Voting Shares,$4.21,0.05,1.202%,5476061.00,Canada,,161466,Health Care,Biotechnology: Pharmaceutical Preparations
QOMO,Qomolangma Acquisition Corp. Common Stock,$11.66,0.00,0.00%,0.00,United States,2022,16,Finance,Blank Checks
QOMOU,Qomolangma Acquisition Corp. Unit,$12.10,0.40,3.419%,0.00,United States,2022,636,Finance,Blank Checks
QQQX,Nuveen NASDAQ 100 Dynamic Overwrite Fund Shares of Beneficial Interest,$24.74,0.40,1.643%,0.00,United States,,81468,Finance,Finance Companies
QRHC,Quest Resource Holding Corporation Common Stock,$8.62,0.48,5.897%,175705365.00,United States,,67673,Utilities,Environmental Services
QRTEA,Qurate Retail Inc. Series A Common Stock ,$0.6597,0.0697,11.814%,261849144.00,United States,,4754351,Consumer Discretionary,Catalog/Specialty Distribution
QRTEB,Qurate Retail Inc. Series B Common Stock ,$4.10,0.53,14.846%,1627378339.00,United States,,11769,Consumer Discretionary,Catalog/Specialty Distribution
QRTEP,Qurate Retail Inc. 8.0% Fixed Rate Cumulative Redeemable Preferred Stock,$41.67,0.55,1.338%,16539720822.00,United States,,35096,Consumer Discretionary,Catalog/Specialty Distribution
QRVO,Qorvo Inc. Common Stock,$115.52,5.09,4.609%,10958382690.00,United States,,1271079,Technology,Semiconductors
QS,QuantumScape Corporation Class A Common Stock,$6.10,0.28,4.811%,3087292795.00,United States,2020,4603181,Miscellaneous,Industrial Machinery/Components
QSG,QuantaSing Group Limited American Depositary Shares,$1.7511,0.0111,0.638%,96671493.00,China,2023,7456,Real Estate,Other Consumer Services
QSI,Quantum-Si Incorporated Class A Common Stock,$1.01,0.0706,7.515%,143784915.00,United States,2020,501758,Industrials,Industrial Machinery/Components
QSIAW,Quantum-Si Incorporated Warrant,$0.0972,0.0012,1.25%,13837519.00,United States,2020,2857,Industrials,Industrial Machinery/Components
QSR,Restaurant Brands International Inc. Common Shares,$70.36,-0.98,-1.374%,31704335823.00,Canada,2014,1434851,Consumer Discretionary,Restaurants
QTI,QT Imaging Holdings Inc. Common Stock,$0.6676,0.1616,31.937%,14314289.00,United States,,1189256,Health Care,Biotechnology: Electromedical & Electrotherapeutic Apparatus
QTRX,Quanterix Corporation Common Stock,$13.50,0.67,5.222%,518116946.00,United States,2017,231574,Industrials,Biotechnology: Laboratory Analytical Instruments
QTTB,Q32 Bio Inc. Common Stock,$39.49,0.91,2.359%,476240949.00,United States,2018,153355,Health Care,Biotechnology: Pharmaceutical Preparations
QTWO,Q2 Holdings Inc. Common Stock,$74.88,2.13,2.928%,4514003919.00,United States,2014,468722,Technology,Computer Software: Prepackaged Software
QUAD,Quad Graphics Inc Class A Common Stock,$4.73,0.25,5.58%,246721814.00,United States,,104218,Consumer Discretionary,Publishing
QUBT,Quantum Computing Inc. Common Stock,$0.6899,-0.001,-0.145%,63027636.00,United States,,403983,Technology,Computer Software: Prepackaged Software
QUIK,QuickLogic Corporation Common Stock,$9.24,0.48,5.479%,133662227.00,United States,1999,112500,Technology,Semiconductors
QURE,uniQure N.V. Ordinary Shares,$6.19,-0.315,-4.842%,301438262.00,Netherlands,2014,885735,Health Care,Biotechnology: Pharmaceutical Preparations
QVCC,QVC Inc. 6.250% Senior Secured Notes due 2068,$12.44,0.03,0.242%,12.00,United States,2019,36067,Consumer Discretionary,Catalog/Specialty Distribution
QVCD,QVC Inc. 6.375% Senior Secured Notes due 2067,$12.63,0.13,1.04%,13.00,United States,2018,4979,Consumer Discretionary,Catalog/Specialty Distribution
QXO,QXO Inc. Common Stock,$13.90,-0.10,-0.714%,5691079711.00,United States,,3164654,Technology,EDP Services
R,Ryder System Inc. Common Stock,$142.27,3.97,2.871%,6157898445.00,United States,,158540,Consumer Discretionary,Rental/Leasing Companies
RA,Brookfield Real Assets Income Fund Inc. Common Stock,$13.26,0.10,0.76%,0.00,United States,2016,187634,Finance,Investment Managers
RACE,Ferrari N.V. Common Shares,$483.94,6.90,1.446%,117960840550.00,Italy,2015,214682,Consumer Discretionary,Auto Manufacturing
RAIL,FreightCar America Inc. Common Stock,$6.16,0.43,7.504%,116262916.00,United States,2005,315400,Industrials,Railroads
RAMP,LiveRamp Holdings Inc. Common Stock,$25.03,-0.35,-1.379%,1667289499.00,United States,2018,910350,Technology,EDP Services
RAND,Rand Capital Corporation Common Stock,$18.54,0.44,2.431%,47852129.00,United States,,551,Finance,Finance: Consumer Services
RANI,Rani Therapeutics Holdings Inc. Class A Common Stock,$3.07,0.00,0.00%,163957980.00,United States,2021,16245,Health Care,Biotechnology: Pharmaceutical Preparations
RAPP,Rapport Therapeutics Inc. Common Stock,$22.30,1.09,5.139%,815654991.00,United States,2024,68993,Health Care,Biotechnology: Pharmaceutical Preparations
RAPT,RAPT Therapeutics Inc. Common Stock,$2.33,0.03,1.304%,81325099.00,United States,2019,213996,Health Care,Biotechnology: Pharmaceutical Preparations
RARE,Ultragenyx Pharmaceutical Inc. Common Stock,$56.75,0.39,0.692%,5230374533.00,United States,2014,533171,Health Care,Biotechnology: Pharmaceutical Preparations
RAVE,Rave Restaurant Group Inc. Common Stock,$1.80,0.01,0.559%,26255819.00,United States,,6461,Consumer Discretionary,Food Distributors
RAY,Raytech Holding Limited Ordinary Shares,$1.69,0.04,2.424%,29766110.00,Hong Kong,2024,903512,Consumer Discretionary,Consumer Electronics/Appliances
RAYA,Erayak Power Solution Group Inc. Class A Ordinary Shares,$0.97,0.0401,4.312%,12076500.00,China,2022,33491,Consumer Discretionary,Metal Fabrications
RBA,RB Global Inc. Common Stock,$85.67,1.06,1.253%,15785040608.00,Canada,,592604,Consumer Discretionary,Business Services
RBB,RBB Bancorp Common Stock,$22.98,1.10,5.027%,409154028.00,United States,2017,131643,Finance,Major Banks
RBBN,Ribbon Communications Inc. Common Stock,$3.38,0.15,4.644%,589899894.00,United States,,251589,Technology,EDP Services
RBC,RBC Bearings Incorporated Common Stock,$294.90,4.71,1.623%,8619886599.00,United States,2022,69961,Industrials,Metal Fabrications
RBCAA,Republic Bancorp Inc. Class A Common Stock,$64.55,4.43,7.369%,1254469541.00,United States,1998,16199,Finance,Major Banks
RBCP,RBC Bearings Incorporated 5.00% Series A Mandatory Convertible Preferred Stock,$131.25,2.55,1.981%,3836419519.00,United States,2022,8701,Industrials,Metal Fabrications
RBKB,Rhinebeck Bancorp Inc. Common Stock,$8.35,0.15,1.829%,92581518.00,United States,2019,2726,Finance,Banks
RBLX,Roblox Corporation Class A Common Stock,$44.16,0.80,1.845%,28580352000.00,United States,2021,6258733,Technology,Computer Software: Prepackaged Software
RBOT,Vicarious Surgical Inc. Class A Common Stock,$6.88,0.19,2.84%,40573445.00,Hong Kong,2020,15672,Health Care,Industrial Specialties
RBRK,Rubrik Inc. Class A Common Stock,$34.95,-1.22,-3.373%,6293259657.00,United States,2024,799497,Technology,Computer Software: Prepackaged Software
RC,Ready Capital Corproation Common Stock,$8.44,0.04,0.476%,1419733241.00,United States,2013,3188225,Real Estate,Real Estate Investment Trusts
RC^C,Ready Capital Corporation 6.25% Series C Cumulative Convertible Preferred Stock,$18.64,-0.10,-0.534%,,United States,,2036,,
RC^E,Ready Capital Corporation 6.50% Series E Cumulative Redeemable Preferred Stock,$18.74,0.0401,0.214%,,United States,,15773,,
RCAT,Red Cat Holdings Inc. Common Stock,$3.18,-0.01,-0.313%,237230344.00,United States,,951002,Technology,Computer Software: Prepackaged Software
RCB,Ready Capital Corporation 6.20% Senior Notes due 2026,$24.17,0.0142,0.059%,4065752659.00,United States,2019,6199,Real Estate,Real Estate Investment Trusts
RCC,Ready Capital Corporation 5.75% Senior Notes due 2026,$24.31,0.00,0.00%,4089302736.00,United States,2021,3654,Real Estate,Real Estate Investment Trusts
RCEL,Avita Medical Inc. Common Stock,$9.34,0.57,6.499%,242743789.00,United States,,123228,Health Care,Medical/Dental Instruments
RCFA,Perception Capital Corp. IV Class A Ordinary Shares,$11.41,0.03,0.264%,0.00,,2021,200,Finance,Blank Checks
RCG,RENN Fund Inc Common Stock,$1.8499,0.0026,0.141%,0.00,United States,,10033,Finance,Investment Managers
RCI,Rogers Communication Inc. Common Stock,$40.82,0.67,1.669%,21686219707.00,Canada,,477984,Telecommunications,Cable & Other Pay Television Services
RCKT,Rocket Pharmaceuticals Inc. Common Stock,$18.59,0.10,0.541%,1691241219.00,United States,2015,662837,Health Care,Biotechnology: Pharmaceutical Preparations
RCKY,Rocky Brands Inc. Common Stock,$31.72,2.40,8.186%,236282914.00,United States,1993,52859,Consumer Discretionary,Shoe Manufacturing
RCL,Royal Caribbean Cruises Ltd. Common Stock,$163.08,5.19,3.287%,41980109210.00,United States,1993,1792731,Consumer Discretionary,Marine Transportation
RCM,R1 RCM Inc. Common Stock,$14.04,-0.04,-0.284%,5926409841.00,United States,,3248643,Consumer Discretionary,Other Consumer Services
RCMT,RCM Technologies Inc. Common Stock,$19.14,-0.14,-0.726%,146018448.00,United States,,20650,Consumer Discretionary,Professional Services
RCON,Recon Technology Ltd. Class A Ordinary Shares,$2.305,0.005,0.217%,34524189.00,China,2009,12200,Energy,Oilfield Services/Equipment
RCRT,Recruiter.com Group Inc. Common Stock,$2.12,-0.02,-0.935%,7016314.00,United States,,21896,Technology,EDP Services
RCRTW,Recruiter.com Group Inc. Warrant,$0.0055,-0.0001,-1.786%,18203.00,United States,,1000,Technology,EDP Services
RCS,PIMCO Strategic Income Fund Inc.,$6.92,0.08,1.17%,0.00,United States,1994,140216,Finance,Investment Managers
RCUS,Arcus Biosciences Inc. Common Stock,$18.01,0.32,1.809%,1646609365.00,United States,2018,765234,Health Care,Biotechnology: Pharmaceutical Preparations
RDCM,Radcom Ltd. Ordinary Shares,$9.70,0.11,1.147%,148485000.00,Israel,1997,3739,Technology,Computer peripheral equipment
RDDT,Reddit Inc. Class A Common Stock,$59.21,2.78,4.926%,9821521157.00,,2024,5280662,Technology,EDP Services
RDFN,Redfin Corporation Common Stock,$11.08,1.76,18.884%,1349258801.00,United States,2017,19788267,Finance,Real Estate
RDHL,Redhill Biopharma Ltd. American Depositary Shares,$9.02,-0.51,-5.352%,11550462.00,Israel,,113664,Health Care,Biotechnology: Pharmaceutical Preparations
RDI,Reading International Inc Class A Common Stock,$1.81,0.08,4.624%,40591393.00,United States,,30069,Consumer Discretionary,Movies/Entertainment
RDIB,Reading International Inc Class B Common Stock,$10.90,0.16,1.49%,244445406.00,United States,,4732,Consumer Discretionary,Movies/Entertainment
RDN,Radian Group Inc. Common Stock,$35.95,0.86,2.451%,5407557837.00,United States,,660553,Finance,Property-Casualty Insurers
RDNT,RadNet Inc. Common Stock,$65.00,0.92,1.436%,4807221900.00,United States,,497307,Health Care,Medical Specialities
RDUS,Radius Recycling Inc. Class A Common Stock,$15.04,0.63,4.372%,421713388.00,United States,,115980,Consumer Discretionary,Industrial Specialties
RDVT,Red Violet Inc. Common Stock ,$28.70,0.68,2.427%,394094509.00,United States,,41707,Technology,Computer Software: Prepackaged Software
RDW,Redwire Corporation Common Stock,$6.72,0.23,3.544%,447118809.00,United States,2021,322583,Industrials,Military/Government/Technical
