Symbol,Name,Last Sale,Net Change,% Change,Market Cap,Country,IPO Year,Volume,Sector,Industry
DFIN,Donnelley Financial Solutions Inc. Common Stock ,$66.52,1.52,2.338%,1931307023.00,United States,2016,95306,Consumer Discretionary,Other Consumer Services
DFLI,Dragonfly Energy Holdings Corp. Common Stock (NV),$0.6109,0.022,3.736%,38236946.00,United States,2021,202694,Miscellaneous,Industrial Machinery/Components
DFLIW,Dragonfly Energy Holdings Corp. Warrant,$0.0439,0.0039,9.75%,2747752.00,United States,2021,18398,Miscellaneous,Industrial Machinery/Components
DFP,Flaherty & Crumrine Dynamic Preferred and Income Fund Inc. Common Stock,$20.02,0.03,0.15%,0.00,,2013,60688,Finance,Investment Managers
DFS,Discover Financial Services Common Stock,$132.93,1.69,1.288%,33374939812.00,United States,,1914822,Finance,Finance: Consumer Services
DG,Dollar General Corporation Common Stock,$123.60,0.36,0.292%,27178978987.00,United States,2009,1554492,Consumer Discretionary,Department/Specialty Retail Stores
DGHI,Digihost Technology Inc. Common Subordinate Voting Shares,$1.45,0.20,16.00%,43500506.00,Canada,,125020,Finance,Finance: Consumer Services
DGICA,Donegal Group Inc. Class A Common Stock,$14.97,0.35,2.394%,501250241.00,United States,,67286,Finance,Property-Casualty Insurers
DGICB,Donegal Group Inc. Class B Common Stock,$12.77,0.2699,2.159%,427586211.00,United States,1986,1108,Finance,Property-Casualty Insurers
DGII,Digi International Inc. Common Stock,$29.47,1.01,3.549%,1073155472.00,United States,1989,123640,Telecommunications,Computer Communications Equipment
DGLY,Digital Ally Inc. Common Stock,$1.08,-0.04,-3.571%,4163573.00,United States,,113499,Technology,Radio And Television Broadcasting And Communications Equipment
DGX,Quest Diagnostics Incorporated Common Stock,$153.56,0.72,0.471%,17093870460.00,United States,,472339,Health Care,Medical Specialities
DH,Definitive Healthcare Corp. Class A Common Stock,$4.53,0.27,6.338%,530567697.00,United States,2021,812903,Technology,Computer Software: Prepackaged Software
DHAI,DIH Holdings US Inc. Class A Common Stock,$2.58,-0.05,-1.901%,104605932.00,United States,2024,4288,Health Care,Medical/Dental Instruments
DHAIW,DIH Holding US Inc. Warrants,$0.0362,-0.0138,-27.60%,1467727.00,United States,2024,268845,Health Care,Medical/Dental Instruments
DHC,Diversified Healthcare Trust Common Shares of Beneficial Interest,$3.50,0.29,9.034%,842011139.00,United States,,1250849,Real Estate,Real Estate Investment Trusts
DHCNI,Diversified Healthcare Trust 5.625% Senior Notes due 2042,$14.25,0.13,0.921%,3428188207.00,United States,,18864,Real Estate,Real Estate Investment Trusts
DHCNL,Diversified Healthcare Trust 6.25% Senior Notes Due 2046,$15.22,0.0995,0.658%,3661545579.00,United States,,14215,Real Estate,Real Estate Investment Trusts
DHF,BNY Mellon High Yield Strategies Fund Common Stock,$2.54,0.005,0.197%,0.00,United States,1998,302616,Finance,Finance Companies
DHI,D.R. Horton Inc. Common Stock,$191.79,6.05,3.257%,62531230012.00,United States,,3420824,Consumer Discretionary,Homebuilding
DHIL,Diamond Hill Investment Group Inc. Class A Common Stock,$160.96,3.87,2.464%,442804662.00,United States,,23286,Finance,Investment Managers
DHR,Danaher Corporation Common Stock,$269.48,1.65,0.616%,194621981068.00,United States,,1463120,Industrials,Industrial Machinery/Components
DHT,DHT Holdings Inc.,$10.67,-0.17,-1.568%,1717865113.00,Jersey,2005,1760627,Consumer Discretionary,Marine Transportation
DHX,DHI Group Inc. Common Stock,$1.64,-0.01,-0.606%,79382337.00,United States,2007,159803,Consumer Discretionary,Business Services
DHY,Credit Suisse High Yield Bond Fund Common Stock,$2.11,0.02,0.957%,0.00,United States,1998,686102,Finance,Finance/Investors Services
DIAX,Nuveen Dow 30SM Dynamic Overwrite Fund Common Shares of Beneficial Interest,$14.59,0.19,1.319%,0.00,,2014,59625,Finance,Finance Companies
DIBS,1stdibs.com Inc. Common Stock,$4.78,0.24,5.286%,189733200.00,United States,2021,64089,Consumer Discretionary,Catalog/Specialty Distribution
DIN,Dine Brands Global Inc. Common Stock,$32.87,0.71,2.208%,502878623.00,United States,,400856,Consumer Discretionary,Restaurants
DINO,HF Sinclair Corporation Common Stock,$48.98,1.63,3.442%,9346202652.00,United States,1960,2066673,Energy,Natural Gas Distribution
DIOD,Diodes Incorporated Common Stock,$71.28,4.31,6.436%,3302515094.00,United States,,295903,Technology,Semiconductors
DIS,Walt Disney Company (The) Common Stock,$90.56,0.64,0.712%,164238473133.00,United States,,7361774,Consumer Discretionary,Services-Misc. Amusement & Recreation
DIST,Distoken Acquisition Corporation Ordinary Shares,$10.80,0.0001,0.001%,0.00,China,2023,44399,Finance,Blank Checks
DISTR,Distoken Acquisition Corporation Right,$0.11,0.00,0.00%,0.00,China,2023,1266,Finance,Blank Checks
DISTW,Distoken Acquisition Corporation Warrant,$0.014,-0.006,-30.00%,0.00,China,2023,1366,Finance,Blank Checks
DIT,AMCON Distributing Company Common Stock,$142.89,2.89,2.064%,90072426.00,United States,1999,22,Consumer Discretionary,Food Distributors
DJCO,Daily Journal Corp. (S.C.) Common Stock,$488.55,30.94,6.761%,672941472.00,United States,,26968,Consumer Discretionary,Newspapers/Magazines
DJT,Trump Media & Technology Group Corp. Common Stock,$22.81,0.11,0.485%,4441466759.00,United States,2024,7364939,Technology,Computer Software: Programming Data Processing
DJTWW,Trump Media & Technology Group Corp. Warrants,$15.06,-0.23,-1.504%,2932419526.00,United States,2021,49562,Technology,Computer Software: Programming Data Processing
DK,Delek US Holdings Inc. Common Stock,$20.81,0.71,3.532%,1343048786.00,United States,2017,1192265,Energy,Integrated oil Companies
DKL,Delek Logistics Partners L.P. Common Units representing Limited Partner Interests,$38.97,0.07,0.18%,1840551190.00,United States,2012,35932,Energy,Natural Gas Distribution
DKNG,DraftKings Inc. Class A Common Stock,$36.37,1.12,3.177%,17658740830.00,United States,2019,7263545,Consumer Discretionary,Services-Misc. Amusement & Recreation
DKS,Dick's Sporting Goods Inc Common Stock,$239.18,4.03,1.714%,19490815273.00,United States,2002,663466,Consumer Discretionary,Other Specialty Stores
DLB,Dolby Laboratories Common Stock,$71.57,-0.33,-0.459%,6824029378.00,United States,2005,835506,Miscellaneous,Multi-Sector Companies
DLHC,DLH Holdings Corp.,$11.02,0.52,4.952%,156295459.00,United States,,54459,Consumer Discretionary,Professional Services
DLNG,Dynagas LNG Partners LP Common Units,$3.71,0.03,0.815%,136668138.00,Greece,,11054,Consumer Discretionary,Marine Transportation
DLNG^A,Dynagas LNG Partners LP 9.00% Series A Cumulative Redeemable Preferred Units,$25.4001,0.1134,0.448%,,Greece,,3414,,
DLNG^B,Dynagas LNG Partners LP 8.75% Series B Fixed to Floating Rate Cumulative Redeemable Perpetual Preferred Units liquidation preference $25.00 per Uni,$25.765,0.0416,0.162%,,Greece,,2273,,
DLO,DLocal Limited Class A Common Shares,$8.52,-0.20,-2.294%,2521848986.00,Uruguay,2021,1014285,Consumer Discretionary,Business Services
DLPN,Dolphin Entertainment Inc. Common Stock,$0.7199,0.0699,10.754%,15993565.00,United States,,82742,Consumer Discretionary,Other Consumer Services
DLR,Digital Realty Trust Inc. Common Stock,$152.18,1.49,0.989%,49825412980.00,United States,2004,1602928,Real Estate,Real Estate Investment Trusts
DLR^J,Digital Realty Trust Inc. 5.250% Series J Cumulative Redeemable Preferred Stock,$23.34,0.1968,0.85%,,United States,,9513,,
DLR^K,Digital Realty Trust Inc. 5.850% Series K Cumulative Redeemable Preferred Stock par value $0.01 per share,$25.05,0.08,0.32%,,United States,,19620,,
DLR^L,Digital Realty Trust Inc. 5.200% Series L Cumulative Redeemable Preferred Stock,$23.18,0.12,0.52%,,United States,,9910,,
DLTH,Duluth Holdings Inc. Class B Common Stock,$3.385,0.265,8.494%,118696690.00,United States,2015,238848,Consumer Discretionary,Clothing/Shoe/Accessory Stores
DLTR,Dollar Tree Inc. Common Stock,$97.00,-0.96,-0.98%,20849568000.00,United States,1995,2163481,Consumer Discretionary,Department/Specialty Retail Stores
DLX,Deluxe Corporation Common Stock,$20.41,1.02,5.26%,902349327.00,United States,,210233,Consumer Discretionary,Publishing
DLY,DoubleLine Yield Opportunities Fund Common Shares of Beneficial Interest,$16.31,-0.01,-0.061%,781995655.00,United States,2020,127620,Finance,Investment Managers
DM,Desktop Metal Inc. Class A Common Stock,$4.34,0.09,2.118%,144233850.00,United States,2019,362459,Technology,Industrial Machinery/Components
DMA,Destra Multi-Alternative Fund Common Stock,$8.27,0.04,0.486%,0.00,,2022,28161,Finance,Trusts Except Educational Religious and Charitable
DMAC,DiaMedica Therapeutics Inc. Common Stock,$4.00,0.02,0.503%,170991328.00,United States,2018,30296,Health Care,Biotechnology: Pharmaceutical Preparations
DMB,BNY Mellon Municipal Bond Infrastructure Fund Inc. Common Stock,$10.86,0.0705,0.653%,0.00,,2013,67667,Finance,Trusts Except Educational Religious and Charitable
DMF,BNY Mellon Municipal Income Inc. Common Stock,$7.30,0.05,0.69%,454723234.00,United States,1988,30997,Finance,Finance/Investors Services
DMLP,Dorchester Minerals L.P. Common Units Representing Limited Partnership Interests,$30.78,0.28,0.918%,1233927477.00,United States,,33026,Energy,Oil & Gas Production
DMO,Western Asset Mortgage Opportunity Fund Inc. Common Stock,$12.12,-0.11,-0.899%,0.00,United States,2010,62628,Finance,Trusts Except Educational Religious and Charitable
DMRC,Digimarc Corporation Common Stock,$28.81,1.29,4.688%,617128206.00,United States,,86079,Technology,EDP Services
DMYY,dMY Squared Technology Group Inc. Class A Common Stock,$10.64,-0.06,-0.561%,0.00,,2022,1747,Finance,Blank Checks
DNA,Ginkgo Bioworks Holdings Inc. Class A Common Stock,$8.15,-0.15,-1.807%,452939388.00,United States,2021,1370834,Health Care,Biotechnology: Biological Products (No Diagnostic Substances)
DNB,Dun & Bradstreet Holdings Inc. Common Stock,$12.13,0.26,2.19%,5358865818.00,United States,2020,4497689,Finance,Finance: Consumer Services
DNLI,Denali Therapeutics Inc. Common Stock,$24.77,0.88,3.684%,3546203589.00,United States,2017,714572,Health Care,Biotechnology: Biological Products (No Diagnostic Substances)
DNMR,Danimer Scientific Inc. Common Stock,$0.37,-0.016,-4.145%,44462940.00,United States,2020,455381,Industrials,Major Chemicals
DNN,Denison Mines Corp Ordinary Shares (Canada),$1.71,0.21,14.00%,1525952585.00,Canada,,28184012,Basic Materials,Other Metals and Minerals
DNOW,DNOW Inc. Common Stock,$12.90,0.35,2.789%,1373462936.00,United States,2014,651645,Industrials,Metal Fabrications
DNP,DNP Select Income Fund Inc. Common Stock,$9.41,0.15,1.62%,0.00,United States,1987,623474,Finance,Investment Managers
DNTH,Dianthus Therapeutics Inc. Common Stock,$28.30,0.68,2.462%,830727256.00,United States,2018,122184,Health Care,Biotechnology: Pharmaceutical Preparations
DNUT,Krispy Kreme Inc. Common Stock,$10.69,-0.04,-0.373%,1813024000.00,United States,2021,895392,Consumer Staples,Food Chains
DO,Diamond Offshore Drilling Inc. Common Stock,$14.36,0.39,2.792%,1482139470.00,United States,2022,2394179,Energy,Oil & Gas Production
DOC,Healthpeak Properties Inc. Common Stock,$22.46,0.34,1.537%,15706085158.00,United States,,2741692,Real Estate,Real Estate Investment Trusts
DOCN,DigitalOcean Holdings Inc. Common Stock,$38.00,1.42,3.882%,3498369148.00,United States,2021,1327651,Technology,Computer Software: Programming Data Processing
DOCS,Doximity Inc. Class A Common Stock,$36.51,0.25,0.689%,6778468506.00,United States,2021,1178477,Technology,EDP Services
DOCU,DocuSign Inc. Common Stock,$57.44,0.74,1.305%,11758907374.00,United States,1989,1297510,Technology,Computer Software: Prepackaged Software
DOGZ,Dogness (International) Corporation Class A Common Stock,$19.77,0.76,3.998%,209992255.00,China,2017,327629,Consumer Discretionary,Miscellaneous manufacturing industries
DOLE,Dole plc Ordinary Shares,$15.80,0.08,0.509%,1499881028.00,Ireland,2021,926849,Consumer Staples,Farming/Seeds/Milling
DOMA,Doma Holdings Inc. Common Stock,$6.09,0.045,0.744%,86390724.00,United States,2021,8925,Finance,Specialty Insurers
DOMH,Dominari Holdings Inc. Common Stock,$1.63,0.06,3.822%,10230105.00,United States,,3127,Health Care,Biotechnology: Pharmaceutical Preparations
DOMO,Domo Inc. Class B Common Stock,$8.09,0.21,2.665%,308833347.00,United States,2018,312208,Technology,Computer Software: Prepackaged Software
DOOO,BRP Inc. (Recreational Products) Common Subordinate Voting Shares,$71.58,4.17,6.186%,5365384051.00,Canada,,124585,Consumer Discretionary,Industrial Specialties
DORM,Dorman Products Inc. Common Stock,$111.89,2.74,2.51%,3420733192.00,United States,,126563,Consumer Discretionary,Auto Parts:O.E.M.
DOUG,Douglas Elliman Inc. Common Stock,$1.94,0.13,7.182%,178155275.00,United States,2021,632211,Finance,Real Estate
DOV,Dover Corporation Common Stock,$184.64,3.10,1.708%,25380174772.00,United States,,414429,Industrials,Industrial Machinery/Components
DOW,Dow Inc. Common Stock ,$53.53,0.97,1.846%,37520302629.00,United States,2019,4901481,Industrials,Major Chemicals
DOX,Amdocs Limited Ordinary Shares,$85.43,0.67,0.79%,10025024177.00,Guernsey,,271550,Technology,EDP Services
DOYU,DouYu International Holdings Limited ADS,$17.94,0.39,2.222%,567542198.00,China,2019,108698,Technology,Computer Software: Programming Data Processing
DPCS,DP Cap Acquisition Corp I Class A Ordinary Shares,$11.37,0.00,0.00%,0.00,United States,2021,5738,Finance,Blank Checks
DPCSU,DP Cap Acquisition Corp I Unit,$11.21,0.00,0.00%,0.00,United States,2021,4,Finance,Blank Checks
DPCSW,DP Cap Acquisition Corp I Warrants,$0.035,-0.005,-12.50%,0.00,United States,2021,711,Finance,Blank Checks
DPG,Duff & Phelps Utility and Infrastructure Fund Inc.,$10.89,0.13,1.208%,0.00,United States,2011,233103,Finance,Trusts Except Educational Religious and Charitable
DPRO,Draganfly Inc. Common Shares,$0.1403,0.0082,6.207%,8894069.00,Canada,,2588267,Industrials,Aerospace
DPZ,Domino's Pizza Inc Common Stock,$425.28,9.05,2.174%,14873388036.00,United States,2004,833441,Consumer Discretionary,Food Distributors
DQ,DAQO New Energy Corp. American Depositary Shares each representing five ordinary shares,$15.20,0.13,0.863%,1003313255.00,China,2010,1079515,Technology,Semiconductors
DRCT,Direct Digital Holdings Inc. Class A Common Stock,$3.11,0.01,0.323%,44381022.00,United States,2022,90179,Consumer Discretionary,Advertising
DRD,DRDGOLD Limited American Depositary Shares,$8.67,-0.02,-0.23%,749598412.00,South Africa,,374419,Basic Materials,Precious Metals
DRH,Diamondrock Hospitality Company Common Stock,$8.67,0.19,2.241%,1796923479.00,United States,2005,1379488,Real Estate,Real Estate Investment Trusts
DRH^A,Diamondrock Hospitality Company 8.250% Series A Cumulative Redeemable Preferred Stock,$25.40,-0.1099,-0.431%,,United States,,1640,,
DRI,Darden Restaurants Inc. Common Stock,$154.07,0.17,0.11%,18313214707.00,United States,,969342,Consumer Discretionary,Restaurants
DRIO,DarioHealth Corp. Common Stock,$0.9295,0.0191,2.098%,27911286.00,Israel,,15579,Health Care,Medical/Dental Instruments
DRMA,Dermata Therapeutics Inc. Common Stock,$1.79,-0.05,-2.717%,2355606.00,United States,2021,88384,Health Care,Biotechnology: Pharmaceutical Preparations
DRQ,Dril-Quip Inc. Common Stock,$15.94,0.55,3.574%,549168546.00,United States,1997,246308,Industrials,Metal Fabrications
DRRX,DURECT Corporation Common Stock,$1.43,0.07,5.147%,44386315.00,United States,2000,54429,Health Care,Biotechnology: Pharmaceutical Preparations
DRS,Leonardo DRS Inc. Common Stock,$28.42,0.36,1.283%,7494433775.00,Israel,,435093,Industrials,Industrial Machinery/Components
DRTS,Alpha Tau Medical Ltd. Ordinary Shares,$2.20,-0.03,-1.345%,153275346.00,Israel,,17929,Health Care,Medical/Dental Instruments
DRTSW,Alpha Tau Medical Ltd. Warrant,$0.24,0.0413,20.785%,16720947.00,Israel,,916,Health Care,Medical/Dental Instruments
DRUG,Bright Minds Biosciences Inc. Common Stock,$1.01,-0.02,-1.942%,4508475.00,Canada,,17091,Health Care,Biotechnology: Pharmaceutical Preparations
DRVN,Driven Brands Holdings Inc. Common Stock,$14.50,0.47,3.35%,2379187231.00,United States,2021,437367,Consumer Discretionary,Automotive Aftermarket
DSGN,Design Therapeutics Inc. Common Stock,$4.89,-0.02,-0.407%,276874367.00,United States,2021,119161,Health Care,Biotechnology: Pharmaceutical Preparations
DSGR,Distribution Solutions Group Inc. Common Stock,$37.43,1.21,3.341%,1750127985.00,United States,,58316,Consumer Discretionary,Industrial Specialties
DSGX,Descartes Systems Group Inc. (The) Common Stock,$99.50,0.01,0.01%,8496319129.00,Canada,,118119,Technology,Computer Software: Prepackaged Software
DSL,DoubleLine Income Solutions Fund Common Shares of Beneficial Interests,$12.86,0.00,0.00%,1311679208.00,United States,2013,262629,Finance,Trusts Except Educational Religious and Charitable
DSM,BNY Mellon Strategic Municipal Bond Fund Inc. Common Stock,$6.15,0.02,0.326%,0.00,United States,1989,50632,Finance,Investment Managers
DSP,Viant Technology Inc. Class A Common Stock,$11.09,0.43,4.034%,700877819.00,United States,2021,91897,Technology,Computer Software: Programming Data Processing
DSS,DSS Inc. Common Stock,$1.30,-0.01,-0.763%,9186804.00,United States,,9249,Consumer Discretionary,Containers/Packaging
DSU,Blackrock Debt Strategies Fund Inc. Common Stock,$10.80,0.09,0.84%,0.00,United States,1998,138319,Finance,Finance Companies
DSWL,Deswell Industries Inc. Common Shares,$2.45,0.0201,0.827%,39041336.00,Macau,1995,7434,Industrials,Plastic Products
DSX,Diana Shipping inc. common stock,$2.40,-0.01,-0.415%,287911001.00,Greece,2005,499026,Consumer Discretionary,Marine Transportation
DSX^B,Diana Shipping Inc. Perpetual Preferred Shares Series B (Marshall Islands),$26.49,-0.0189,-0.071%,,Greece,,178,,
DSY,Big Tree Cloud Holdings Limited Ordinary Shares,$2.93,0.47,19.106%,167246000.00,China,,226351,Consumer Discretionary,Containers/Packaging
DSYWW,Big Tree Cloud Holdings Limited Warrants,$0.0445,-0.0017,-3.68%,2540084.00,China,,8622,Consumer Discretionary,Containers/Packaging
DT,Dynatrace Inc. Common Stock,$50.24,0.09,0.179%,14966768502.00,United States,2019,1670855,Technology,Computer Software: Prepackaged Software
DTB,DTE Energy Company 2020 Series G 4.375% Junior Subordinated Debentures due 2080,$20.35,0.11,0.543%,4212858628.00,United States,2020,5400,Utilities,Electric Utilities: Central
DTC,Solo Brands Inc. Class A Common Stock,$1.56,0.10,6.849%,142942859.00,United States,2021,393629,Consumer Discretionary,Recreational Games/Products/Toys
DTCK,Davis Commodities Limited Ordinary Shares,$1.24,0.04,3.333%,30380775.00,Singapore,2023,29739,Industrials,Farming/Seeds/Milling
DTE,DTE Energy Company Common Stock,$123.82,0.48,0.389%,25633226306.00,United States,,489248,Utilities,Electric Utilities: Central
DTF,DTF Tax-Free Income 2028 Term Fund Inc. Common Stock,$11.255,0.01,0.089%,79117777.00,United States,1991,4103,Finance,Investment Managers
DTG,DTE Energy Company 2021 Series E 4.375% Junior Subordinated Debentures,$19.97,0.02,0.10%,4134190998.00,United States,2021,14851,Utilities,Electric Utilities: Central
DTI,Drilling Tools International Corporation Common Stock,$4.07,0.16,4.092%,141248113.00,United States,2021,22402,Industrials,Metal Fabrications
DTIL,Precision BioSciences Inc. Common Stock,$9.69,-0.03,-0.309%,70095134.00,United States,2019,19405,Health Care,Biotechnology: Biological Products (No Diagnostic Substances)
DTM,DT Midstream Inc. Common Stock ,$76.57,0.81,1.069%,7435841031.00,United States,2021,444693,Utilities,Natural Gas Distribution
DTSQU,DT Cloud Star Acquisition Corporation Units,$10.045,-0.015,-0.149%,0.00,United States,2024,191,,
DTSS,Datasea Inc. Common Stock,$2.13,0.00,0.00%,6513421.00,China,,22736,Technology,Computer Software: Prepackaged Software
DTST,Data Storage Corporation Common Stock,$3.79,0.10,2.71%,26514165.00,United States,,62288,Technology,EDP Services
DTSTW,Data Storage Corporation Warrant,$0.5655,0.0154,2.799%,3956137.00,United States,,600,Technology,EDP Services
DTW,DTE Energy Company 2017 Series E 5.25% Junior Subordinated Debentures due 2077,$23.80,0.16,0.677%,4927077904.00,United States,2017,22307,Utilities,Electric Utilities: Central
DUET,DUET Acquisition Corp. Class A Common Stock,$11.24,0.02,0.178%,0.00,Malaysia,2022,2002,Finance,Blank Checks
DUETW,DUET Acquisition Corp. Warrant,$0.0188,-0.0012,-6.00%,0.00,Malaysia,2022,200,Finance,Blank Checks
DUK,Duke Energy Corporation (Holding Company) Common Stock,$112.36,0.24,0.214%,86764583686.00,United States,,2731223,Utilities,Power Generation
DUK^A,Duke Energy Corporation Depositary Shares each representing a 1/1000th interest in a share of 5.75% Series A Cumulative Redeemable Perpetual Preferred Stock,$25.10,0.05,0.20%,,United States,,82407,,
DUKB,Duke Energy Corporation 5.625% Junior Subordinated Debentures due 2078,$25.25,0.01,0.04%,19498093077.00,United States,2018,15896,Utilities,Power Generation
DUO,Fangdd Network Group Ltd. American Depositary Shares,$0.4585,-0.0065,-1.398%,2755858.00,China,2019,146247,Finance,Real Estate
DUOL,Duolingo Inc. Class A Common Stock,$212.57,3.90,1.869%,9255031875.00,United States,2021,354196,Technology,Computer Software: Prepackaged Software
DUOT,Duos Technologies Group Inc. Common Stock,$2.58,0.09,3.614%,19840120.00,United States,,17880,Technology,Computer Software: Prepackaged Software
DV,DoubleVerify Holdings Inc. Common Stock,$19.52,0.41,2.145%,3319274711.00,United States,2021,831574,Technology,Computer Software: Programming Data Processing
DVA,DaVita Inc. Common Stock,$153.99,1.64,1.076%,12919761000.00,United States,,475303,Health Care,Misc Health and Biotechnology Services
DVAX,Dynavax Technologies Corporation Common Stock,$11.49,0.21,1.862%,1505699961.00,United States,2004,1332829,Health Care,Biotechnology: Pharmaceutical Preparations
DVN,Devon Energy Corporation Common Stock,$44.70,1.03,2.359%,27991140000.00,United States,1985,4310793,Energy,Oil & Gas Production
DWSN,Dawson Geophysical Company Common Stock,$1.53,0.00,0.00%,47287369.00,United States,,10413,Energy,Oil & Gas Production
DX,Dynex Capital Inc. Common Stock,$12.32,0.01,0.081%,920399800.00,United States,,1359743,Real Estate,Real Estate Investment Trusts
DX^C,Dynex Capital Inc. 6.900% Series C Fixed-to-Floating Rate Cumulative Redeemable Preferred Stock,$24.94,0.00,0.00%,,United States,,2425,,
DXC,DXC Technology Company Common Stock ,$20.11,-0.05,-0.248%,3636154055.00,United States,,580598,Technology,EDP Services
DXCM,DexCom Inc. Common Stock,$74.07,1.79,2.476%,29681835854.00,United States,2005,3355509,Health Care,Medical/Dental Instruments
DXF,Dunxin Financial Holdings Limited American Depositary Shares,$0.1585,0.0212,15.441%,3547987.00,China,,663945,Finance,Finance: Consumer Services
DXLG,Destination XL Group Inc. Common Stock,$2.95,0.18,6.498%,171772756.00,United States,,470277,Consumer Discretionary,Clothing/Shoe/Accessory Stores
DXPE,DXP Enterprises Inc. Common Stock,$51.85,1.69,3.369%,818644821.00,United States,,80919,Industrials,Industrial Machinery/Components
DXR,Daxor Corporation Common Stock,$8.3036,-0.0764,-0.912%,34843417.00,United States,,358,Health Care,Medical/Dental Instruments
DXYN,Dixie Group Inc. (The) Common Stock,$0.90,0.03,3.448%,13844801.00,United States,,42019,Consumer Discretionary,Home Furnishings
DXYZ,Destiny Tech100 Inc. Common Stock,$12.47,-0.10,-0.796%,0.00,,2024,208424,,
DY,Dycom Industries Inc. Common Stock,$180.12,4.43,2.521%,5240264302.00,United States,,435196,Industrials,Water Sewer Pipeline Comm & Power Line Construction
DYAI,Dyadic International Inc. Common Stock,$1.4499,0.0799,5.832%,42739629.00,United States,,69370,Health Care,Biotechnology: Biological Products (No Diagnostic Substances)
DYCQ,DT Cloud Acquisition Corporation Ordinary Shares,$10.285,0.00,0.00%,0.00,United Kingdom,2024,8,,
DYN,Dyne Therapeutics Inc. Common Stock,$46.53,1.04,2.286%,4671649131.00,United States,2020,605361,Health Care,Biotechnology: Pharmaceutical Preparations
E,ENI S.p.A. Common Stock,$32.70,0.64,1.996%,55196584567.00,Italy,,103120,Energy,Oil & Gas Production
EA,Electronic Arts Inc. Common Stock,$147.62,0.49,0.333%,39001193814.00,United States,,1477475,Technology,Computer Software: Prepackaged Software
EAD,Allspring Income Opportunities Fund Common Shares,$7.01,0.02,0.286%,0.00,United States,2003,117195,Finance,Finance/Investors Services
EAF,GrafTech International Ltd. Common Stock,$0.7333,0.0812,12.452%,188580654.00,United States,2018,1603352,Energy,Industrial Machinery/Components
EAI,Entergy Arkansas LLC First Mortgage Bonds 4.875% Series Due September 1 2066,$22.91,0.17,0.748%,4898864682.00,United States,2016,29386,Utilities,Electric Utilities: Central
EARN,Ellington Credit Company Common Shares of Beneficial Interest,$6.99,0.13,1.895%,177035667.00,United States,2013,415074,Real Estate,Real Estate Investment Trusts
EAST,Eastside Distilling Inc. Common Stock,$0.8064,-0.0276,-3.309%,1422078.00,United States,,13542,Consumer Staples,Beverages (Production/Distribution)
EAT,Brinker International Inc. Common Stock,$71.13,2.55,3.718%,3164610403.00,United States,,1500285,Consumer Discretionary,Restaurants
EB,Eventbrite Inc. Class A Common Stock,$3.41,0.04,1.187%,327704887.00,United States,2018,1059492,Technology,Computer Software: Programming Data Processing
EBAY,eBay Inc. Common Stock,$58.88,-0.14,-0.237%,28792320000.00,United States,1998,2823962,Consumer Discretionary,Business Services
EBC,Eastern Bankshares Inc. Common Stock,$16.64,0.91,5.785%,3588387695.00,United States,2020,1129262,Finance,Savings Institutions
EBF,Ennis Inc. Common Stock,$23.30,0.46,2.014%,605427526.00,United States,,93761,Consumer Discretionary,Office Equipment/Supplies/Services
EBMT,Eagle Bancorp Montana Inc. Common Stock,$14.80,0.81,5.79%,118648403.00,United States,2010,13932,Finance,Major Banks
EBON,Ebang International Holdings Inc. Class A Ordinary Shares,$6.56,0.37,5.977%,42928233.00,China,2020,38052,Technology,Semiconductors
