Symbol,Name,Last Sale,Net Change,% Change,Market Cap,Country,IPO Year,Volume,Sector,Industry
JSPRW,Japer Therapeutics Inc. Warrants,$0.217,-0.0005,-0.23%,3277850.00,United States,2020,2760,Health Care,Biotechnology: Biological Products (No Diagnostic Substances)
JTAI,Jet.AI Inc. Common Stock,$0.2061,0.0042,2.08%,5065295.00,Cayman Islands,2021,13716907,Consumer Discretionary,Transportation Services
JTAIW,Jet.AI Inc. Warrant,$0.0843,-0.0131,-13.45%,2071831.00,Cayman Islands,2021,450,Consumer Discretionary,Transportation Services
JTAIZ,Jet.AI Inc. Merger Consideration Warrants,$0.17,0.01,6.25%,4178070.00,Cayman Islands,,1073,Consumer Discretionary,Transportation Services
JUNE,Junee Limited Ordinary Shares,$4.618,0.078,1.718%,58714573.00,Hong Kong,2024,11654,,
JVA,Coffee Holding Co. Inc. Common Stock,$2.4004,0.1104,4.821%,13702921.00,United States,2005,22947,Consumer Staples,Packaged Foods
JVSA,JV SPAC Acquisition Corp. Class A Ordinary Share,$10.25,0.02,0.196%,0.00,China,2024,64527,,
JVSAR,JV SPAC Acquisition Corp. Right,$0.312,-0.002,-0.637%,0.00,China,2024,44461,,
JWEL,Jowell Global Ltd. Ordinary Shares,$1.55,0.07,4.73%,3364236.00,China,2021,2683,Consumer Discretionary,Other Consumer Services
JWN,Nordstrom Inc. Common Stock,$21.73,0.58,2.742%,3556087989.00,United States,,2224796,Consumer Discretionary,Clothing/Shoe/Accessory Stores
JWSM,Jaws Mustang Acquisition Corp. Class A Ordinary Shares,$11.2299,0.00,0.00%,0.00,,2021,6,Finance,Blank Checks
JXJT,JX Luxventure Limited Common Stock,$1.83,-0.04,-2.139%,11095641.00,China,2013,27749,Consumer Staples,Apparel
JXN,Jackson Financial Inc. Class A Common Stock ,$87.16,3.13,3.725%,6558006955.00,United States,2021,736250,Finance,Life Insurance
JXN^A,Jackson Financial Inc. Depositary Shares each representing a 1/1000th interest in a share of Fixed-Rate Reset Noncumulative Perpetual Preferred Stock Series A,$26.71,-0.04,-0.15%,,United States,,17568,,
JYD,Jayud Global Logistics Limited Class A Ordinary Shares,$0.81,0.06,8.00%,17295301.00,China,2023,42370,Consumer Discretionary,Oil Refining/Marketing
JYNT,The Joint Corp. Common Stock,$11.46,0.30,2.688%,171863042.00,United States,2014,23835,Miscellaneous,Multi-Sector Companies
JZ,Jianzhi Education Technology Group Company Limited American Depositary Shs,$0.80,-0.06,-6.977%,16148000.00,China,2022,1384,Real Estate,Other Consumer Services
JZXN,Jiuzi Holdings Inc. Ordinary Shares,$2.26,-0.27,-10.672%,20462035.00,China,2021,41248,Consumer Discretionary,Retail-Auto Dealers and Gas Stations
K,Kellanova Common Stock,$80.67,0.03,0.037%,27612356423.00,United States,,2489572,Consumer Staples,Packaged Foods
KA,Kineta Inc. Common Stock,$0.6299,-0.0301,-4.561%,7723460.00,United States,2016,39482,Health Care,Biotechnology: Pharmaceutical Preparations
KACL,Kairous Acquisition Corp. Limited Ordinary Shares,$12.15,0.00,0.00%,0.00,Malaysia,2022,100,Finance,Blank Checks
KAI,Kadant Inc Common Stock,$320.25,10.09,3.253%,3761196621.00,United States,1992,46451,Industrials,Industrial Machinery/Components
KALA,KALA BIO Inc. Common Stock,$6.01,0.01,0.167%,27691490.00,United States,2017,6035,Health Care,Biotechnology: Pharmaceutical Preparations
KALU,Kaiser Aluminum Corporation Common Stock,$74.30,3.48,4.914%,1195272422.00,United States,,87274,Industrials,Metal Fabrications
KALV,KalVista Pharmaceuticals Inc. Common Stock,$12.63,0.21,1.691%,539751222.00,United Kingdom,2015,168946,Health Care,Biotechnology: Pharmaceutical Preparations
KAR,OPENLANE Inc. Common Stock,$17.62,0.45,2.621%,1913872877.00,United States,2009,621435,Consumer Discretionary,Retail-Auto Dealers and Gas Stations
KARO,Karooooo Ltd. Ordinary Shares,$36.68,-1.33,-3.499%,1133412000.00,Singapore,2021,181352,Technology,Computer Software: Prepackaged Software
KAVL,Kaival Brands Innovations Group Inc. Common Stock,$0.7201,-0.0159,-2.16%,2061648.00,United States,,122677,Consumer Discretionary,Other Consumer Services
KB,KB Financial Group Inc,$66.30,1.63,2.52%,25105411598.00,South Korea,,148982,Finance,Commercial Banks
KBDC,Kayne Anderson BDC Inc. Common Stock,$16.37,0.31,1.93%,0.00,,2024,30665,,
KBH,KB Home Common Stock,$85.83,4.05,4.952%,6454739493.00,United States,1986,1681109,Consumer Discretionary,Homebuilding
KBR,KBR Inc. Common Stock,$67.25,0.54,0.809%,8947624605.00,United States,2006,522202,Industrials,Military/Government/Technical
KC,Kingsoft Cloud Holdings Limited American Depositary Shares,$2.52,0.08,3.279%,639287846.00,China,2020,836311,Technology,Computer Software: Prepackaged Software
KD,Kyndryl Holdings Inc. Common Stock,$23.94,0.61,2.615%,5535107167.00,United States,2021,917329,Technology,EDP Services
KDLY,Kindly MD Inc. Common Stock,$1.6572,-0.0428,-2.518%,9855648.00,United States,2024,136078,Health Care,Medical/Nursing Services
KDLYW,Kindly MD Inc. Warrants,$0.3599,0.0299,9.061%,2140386.00,United States,2024,590,Health Care,Medical/Nursing Services
KDP,Keurig Dr Pepper Inc. Common Stock,$35.73,0.06,0.168%,48452966250.00,United States,,3960581,Consumer Staples,Beverages (Production/Distribution)
KE,Kimball Electronics Inc. Common Stock,$18.24,0.43,2.414%,453614317.00,United States,,181533,Technology,Electrical Products
KELYA,Kelly Services Inc. Class A Common Stock,$20.78,0.24,1.168%,739110230.00,United States,,156625,Consumer Discretionary,Professional Services
KELYB,Kelly Services Inc. Class B Common Stock,$19.70,0.00,0.00%,700696416.00,United States,,10,Consumer Discretionary,Professional Services
KEN,Kenon Holdings Ltd. Ordinary Shares,$24.93,0.38,1.548%,1315452516.00,Singapore,2015,2676,Utilities,Electric Utilities: Central
KEP,Korea Electric Power Corporation Common Stock,$8.04,0.19,2.42%,10322782358.00,South Korea,1994,73969,Utilities,Electric Utilities: Central
KEQU,Kewaunee Scientific Corporation Common Stock,$52.30,-0.49,-0.928%,148539479.00,United States,,11671,Industrials,Medical Specialities
KEX,Kirby Corporation Common Stock,$119.03,2.40,2.058%,6891837000.00,United States,,259049,Consumer Discretionary,Marine Transportation
KEY,KeyCorp Common Stock,$17.07,0.65,3.959%,16100351162.00,United States,,22893285,Finance,Major Banks
KEY^I,KeyCorp Depositary Shares Each Representing a 1/40th Ownership Interest in a Share of Fixed-to-Floating Rate Perpetual Non-Cumulative Preferred Stock Series E,$25.00,0.15,0.604%,,United States,,235125,,
KEY^J,KeyCorp Depositary Shares each representing a 1/40th ownership interest in a share of Fixed Rate Perpetual Non-Cumulative Preferred Stock Series F,$22.75,0.29,1.291%,,United States,,17308,,
KEY^K,KeyCorp Depositary Shares each representing a 1/40th ownership interest in a share of Fixed Rate Perpetual Non-Cumulative Preferred Stock Series G,$22.625,0.315,1.412%,,United States,,31692,,
KEY^L,KeyCorp Depositary Shares each representing a 1/40th ownership interest in a share of Fixed Rate Perpetual Non-Cumulative Preferred Stock Series H,$24.35,0.20,0.828%,,United States,,21462,,
KEYS,Keysight Technologies Inc. Common Stock,$155.01,0.37,0.239%,27055327282.00,United States,2014,1013904,Industrials,Industrial Machinery/Components
KF,Korea Fund Inc. (The) New Common Stock,$25.65,0.45,1.786%,0.00,United States,,10395,Finance,Investment Managers
KFFB,Kentucky First Federal Bancorp Common Stock,$3.235,-0.075,-2.266%,26199343.00,United States,2005,1207,Finance,Savings Institutions
KFRC,Kforce Inc. Common Stock,$65.91,1.75,2.728%,1277269890.00,United States,1995,65931,Consumer Discretionary,Professional Services
KFS,Kingsway Financial Services Inc. Common Stock (DE),$8.18,0.23,2.893%,227493350.00,Canada,,29882,Finance,Property-Casualty Insurers
KFY,Korn Ferry Common Stock,$72.15,2.10,2.998%,3737947200.00,United States,1999,241630,Consumer Discretionary,Diversified Commercial Services
KGC,Kinross Gold Corporation Common Stock,$9.15,0.11,1.217%,11245350000.00,Canada,2001,13168023,Basic Materials,Precious Metals
KGEI,Kolibri Global Energy Inc. Common stock,$3.1486,0.00,0.00%,112170723.00,United States,,123,Energy,Oil & Gas Production
KGS,Kodiak Gas Services Inc. Common Stock,$27.20,1.10,4.215%,2298661446.00,United States,2023,529275,Utilities,Natural Gas Distribution
KHC,The Kraft Heinz Company Common Stock,$35.91,0.39,1.098%,43418023191.00,United States,,4384962,Consumer Staples,Packaged Foods
KIDS,OrthoPediatrics Corp. Common Stock,$32.56,2.47,8.209%,788421711.00,United States,2017,130588,Health Care,Medical/Dental Instruments
KIM,Kimco Realty Corporation (HC) Common Stock,$23.23,0.41,1.797%,15659625616.00,United States,,4042126,Real Estate,Real Estate Investment Trusts
KIM^L,Kimco Realty Corporation Class L Depositary Shares each of which represents a one-one thousandth fractional interest in a share of 5.125% Class L Cumulative Redeemable Preferred Stock liquidation preference $25000.00 per share,$22.50,0.05,0.223%,,United States,,6300,,
KIM^M,Kimco Realty Corporation Class M Depositary Shares each of which represents a one-one thousandth fractional interest in a share of 5.25% Class M Cumulative Redeemable Preferred Stock liquidation preference $25000.00 per share,$23.04,0.05,0.217%,,United States,,10687,,
KIM^N,Kimco Realty Corporation Depositary Shares each representing 1/1000th interest in a share of 7.25% Class N Cumulative Convertible Perpetual Preferred Stock,$58.81,0.131,0.223%,,United States,,11625,,
KIND,Nextdoor Holdings Inc. Class A Common Stock,$2.64,0.14,5.60%,1002958208.00,United States,,2352813,Technology,Computer Software: Programming Data Processing
KINS,Kingstone Companies Inc. Common Stock,$9.36,0.92,10.90%,103565807.00,United States,,498165,Finance,Property-Casualty Insurers
KIO,KKR Income Opportunities Fund Common Shares,$14.38,0.13,0.912%,0.00,United States,2013,63098,Finance,Investment Managers
KIRK,Kirkland's Inc. COMMONSTOCK,$1.57,0.02,1.29%,20471195.00,United States,2002,131116,Consumer Discretionary,Other Specialty Stores
KITT,Nauticus Robotics Inc. Common stock,$2.10,0.12,6.061%,9764223.00,United States,2021,345934,Industrials,Industrial Machinery/Components
KITTW,Nauticus Robotics Inc. Warrant,$0.0183,-0.0007,-3.684%,85088.00,United States,2021,55103,Industrials,Industrial Machinery/Components
KKR,KKR & Co. Inc. Common Stock,$122.23,3.50,2.948%,108471776410.00,United States,,2446252,Finance,Investment Managers
KKRS,KKR Group Finance Co. IX LLC 4.625% Subordinated Notes due 2061,$20.30,0.12,0.595%,18015029544.00,United States,2021,32573,,
KLAC,KLA Corporation Common Stock,$817.84,19.32,2.419%,109938159992.00,United States,1980,685322,Technology,Electronic Components
KLG,WK Kellogg Co Common Stock,$17.73,0.71,4.172%,1523032513.00,United States,2023,653406,Consumer Staples,Packaged Foods
KLIC,Kulicke and Soffa Industries Inc. Common Stock,$43.57,1.32,3.124%,2374969242.00,Singapore,,680318,Technology,Semiconductors
KLTR,Kaltura Inc. Common Stock,$1.28,0.09,7.563%,190710966.00,United States,2021,128665,Technology,Computer Software: Prepackaged Software
KLXE,KLX Energy Services Holdings Inc. Common Stock,$7.45,0.44,6.277%,125640011.00,United States,,289844,Energy,Oilfield Services/Equipment
KMB,Kimberly-Clark Corporation Common Stock,$143.61,-0.99,-0.685%,48368483761.00,United States,,1252033,Consumer Discretionary,Containers/Packaging
KMDA,Kamada Ltd. Ordinary Shares,$5.72,0.16,2.878%,256484800.00,Israel,2013,63651,Health Care,Biotechnology: Pharmaceutical Preparations
KMI,Kinder Morgan Inc. Common Stock,$21.28,0.28,1.333%,47230164447.00,United States,2011,11375977,Utilities,Natural Gas Distribution
KMPB,Kemper Corporation 5.875% Fixed-Rate Reset Junior Subordinated Debentures due 2062,$23.30,0.06,0.258%,1501141947.00,United States,2022,3984,Finance,Property-Casualty Insurers
KMPR,Kemper Corporation,$62.11,0.23,0.372%,4001541902.00,United States,,188988,Finance,Property-Casualty Insurers
KMT,Kennametal Inc. Common Stock,$25.86,0.70,2.782%,2014514455.00,United States,,525356,Industrials,Industrial Machinery/Components
KMX,CarMax Inc,$85.78,3.65,4.444%,13388452503.00,United States,,1634910,Consumer Discretionary,Retail-Auto Dealers and Gas Stations
KN,Knowles Corporation Common Stock,$18.42,0.62,3.483%,1628830553.00,United States,2014,348202,Consumer Staples,Consumer Electronics/Appliances
KNDI,Kandi Technologies Group Inc. Ordinary Shares,$1.82,0.07,4.00%,158991986.00,China,,81826,Consumer Discretionary,Auto Manufacturing
KNF,Knife Riv Holding Co. Common Stock,$79.48,3.43,4.51%,4499577793.00,United States,2023,273957,Industrials,Mining & Quarrying of Nonmetallic Minerals (No Fuels)
KNOP,KNOT Offshore Partners LP Common Units representing Limited Partner Interests,$7.12,0.31,4.552%,242400977.00,United Kingdom,2013,82293,Consumer Discretionary,Marine Transportation
KNSA,Kiniksa Pharmaceuticals International plc Class A Ordinary Shares,$27.38,1.17,4.464%,1950652835.00,United States,2018,379600,Health Care,Biotechnology: Pharmaceutical Preparations
KNSL,Kinsale Capital Group Inc. Common Stock,$486.46,3.22,0.666%,11327913333.00,United States,,105329,Finance,Property-Casualty Insurers
KNTK,Kinetik Holdings Inc. Class A Common Stock,$43.30,0.85,2.002%,6820568283.00,United States,2022,343927,Utilities,Natural Gas Distribution
KNW,Know Labs Inc. Common Stock,$0.34,0.022,6.918%,33870425.00,,2022,99993,Industrials,Industrial Machinery/Components
KNX,Knight-Swift Transportation Holdings Inc.,$54.17,0.66,1.233%,8768172880.00,United States,2017,1058816,Industrials,Trucking Freight/Courier Services
KO,Coca-Cola Company (The) Common Stock,$69.79,0.46,0.663%,300785698189.00,United States,,11826589,Consumer Staples,Beverages (Production/Distribution)
KOD,Kodiak Sciences Inc Common Stock,$2.87,0.19,7.09%,151004272.00,United States,2018,162938,Health Care,Biotechnology: Biological Products (No Diagnostic Substances)
KODK,Eastman Kodak Company Common New,$5.13,0.21,4.268%,411939000.00,United States,,408391,Consumer Discretionary,Industrial Machinery/Components
KOF,Coca Cola Femsa S.A.B. de C.V.  American Depositary Shares each representing 10 Units (each Unit consists of 3 Series B Shares and 5 Series L Shares),$89.43,1.63,1.856%,18787742901.00,Mexico,1993,75815,Consumer Staples,Beverages (Production/Distribution)
KOP,Koppers Holdings Inc. Common Stock,$39.12,1.48,3.932%,802714860.00,United States,2006,216267,Basic Materials,Forest Products
KOPN,Kopin Corporation Common Stock,$1.04,0.03,2.97%,125806827.00,United States,1992,535208,Technology,Semiconductors
KORE,KORE Group Holdings Inc. Common Stock,$2.44,0.02,0.826%,44146393.00,United States,,41513,Telecommunications,Telecommunications Equipment
KOS,Kosmos Energy Ltd. Common Shares (DE),$4.82,0.16,3.433%,2274156354.00,Bermuda,2011,4115591,Energy,Oil & Gas Production
KOSS,Koss Corporation Common Stock,$9.23,-0.10,-1.072%,85421758.00,United States,,342726,Consumer Staples,Consumer Electronics/Appliances
KPLT,Katapult Holdings Inc. Common Stock,$11.65,-0.03,-0.257%,48567906.00,United States,2019,13527,Consumer Discretionary,Diversified Commercial Services
KPLTW,Katapult Holdings Inc. Warrant,$0.007,-0.0005,-6.667%,29182.00,United States,2019,800,Consumer Discretionary,Diversified Commercial Services
KPRX,Kiora Pharmaceuticals Inc.  Common Stock,$3.77,0.07,1.892%,97583000.00,United States,,8632,Health Care,Biotechnology: Pharmaceutical Preparations
KPTI,Karyopharm Therapeutics Inc. Common Stock,$0.8335,0.0463,5.882%,103923848.00,United States,2013,546296,Health Care,Biotechnology: Pharmaceutical Preparations
KR,Kroger Company (The) Common Stock,$51.95,-0.27,-0.517%,37497033567.00,United States,,2815578,Consumer Staples,Food Chains
KRC,Kilroy Realty Corporation Common Stock,$36.31,1.80,5.216%,4262257738.00,United States,1997,832488,Real Estate,Real Estate Investment Trusts
KREF,KKR Real Estate Finance Trust Inc. Common Stock,$11.58,0.41,3.671%,802878549.00,United States,2017,512605,Real Estate,Real Estate Investment Trusts
KREF^A,KKR Real Estate Finance Trust Inc. 6.50% Series A Cumulative Redeemable Preferred Stock,$20.84,0.41,2.007%,,United States,,43962,,
KRG,Kite Realty Group Trust Common Stock,$25.75,0.47,1.859%,5656390204.00,United States,2004,1570196,Real Estate,Real Estate Investment Trusts
KRKR,36Kr Holdings Inc. American Depositary Shares,$0.2592,0.0126,5.109%,10110278.00,China,2019,112970,Consumer Discretionary,Business Services
KRMD,KORU Medical Systems Inc. Common Stock (DE),$2.35,0.14,6.335%,107760021.00,United States,,93507,Health Care,Medical/Dental Instruments
KRNT,Kornit Digital Ltd. Ordinary Shares,$20.08,0.43,2.188%,958210231.00,Israel,2015,397739,Industrials,Industrial Machinery/Components
KRNY,Kearny Financial Corp Common Stock,$6.88,0.51,8.006%,443326526.00,United States,2005,429059,Finance,Savings Institutions
KRO,Kronos Worldwide Inc Common Stock,$11.77,0.43,3.792%,1353977439.00,United States,,231013,Industrials,Major Chemicals
KRON,Kronos Bio Inc. Common Stock,$0.9799,-0.0034,-0.346%,59082688.00,United States,2020,243798,Health Care,Biotechnology: Pharmaceutical Preparations
KROS,Keros Therapeutics Inc. Common Stock,$45.51,0.77,1.721%,1707630634.00,United States,2020,580878,Health Care,Biotechnology: Pharmaceutical Preparations
KRP,Kimbell Royalty Partners Common Units Representing Limited Partner Interests,$15.91,0.07,0.442%,1519305897.00,United States,2017,297718,Energy,Oil & Gas Production
KRRO,Korro Bio Inc. Common Stock,$45.09,0.90,2.037%,419283568.00,United States,2019,73731,Health Care,Biotechnology: Pharmaceutical Preparations
KRT,Karat Packaging Inc. Common Stock,$26.33,1.12,4.443%,526986129.00,United States,2021,59700,Industrials,Plastic Products
KRUS,Kura Sushi USA Inc. Class A Common Stock,$67.37,3.76,5.911%,757571810.00,United States,2019,191342,Consumer Discretionary,Restaurants
KRYS,Krystal Biotech Inc. Common Stock,$201.58,4.06,2.055%,5791383321.00,United States,2017,204512,Health Care,Biotechnology: Biological Products (No Diagnostic Substances)
KSCP,Knightscope Inc. Class A Common Stock,$0.2764,0.0253,10.076%,42239691.00,United States,2022,3339674,Telecommunications,Telecommunications Equipment
KSM,DWS Strategic Municipal Income Trust,$10.11,0.0599,0.596%,0.00,United States,1989,9928,Finance,Trusts Except Educational Religious and Charitable
KSPI,Joint Stock Company Kaspi.kz American Depository Shares,$127.58,3.21,2.581%,24155163465.00,Kazakhstan,2024,161595,,
KSS,Kohl's Corporation Common Stock,$19.74,0.78,4.114%,2195199195.00,United States,1992,7250335,Consumer Discretionary,Department/Specialty Retail Stores
KT,KT Corporation Common Stock,$15.06,0.41,2.799%,7421972271.00,South Korea,,593368,Telecommunications,Telecommunications Equipment
KTB,Kontoor Brands Inc. Common Stock ,$73.62,2.32,3.254%,4099549504.00,United States,2019,368384,Consumer Discretionary,Apparel
KTCC,Key Tronic Corporation Common Stock,$4.36,-0.03,-0.683%,46921758.00,United States,1983,14426,Technology,Electrical Products
KTF,DWS Municipal Income Trust,$9.7627,0.0277,0.285%,385635807.00,United States,1988,90365,Finance,Finance Companies
KTH,Structures Products Cp 8% CorTS Issued by Peco Energy Cap Tr II Preferred Stock,$28.475,0.0749,0.264%,0.00,United States,,1420,Finance,Finance: Consumer Services
KTN,Structured Products Corp 8.205% CorTS 8.205% Corporate Backed Trust Securities (CorTS),$26.41,-0.09,-0.34%,0.00,United States,,2041,Finance,Finance: Consumer Services
KTOS,Kratos Defense & Security Solutions Inc. Common Stock,$22.77,1.12,5.173%,3438254061.00,United States,,1563221,Industrials,Military/Government/Technical
KTRA,Kintara Therapeutics Inc. Common Stock,$0.2253,-0.0047,-2.043%,12460129.00,United States,,1541988,Health Care,Biotechnology: Pharmaceutical Preparations
KTTA,Pasithea Therapeutics Corp. Common Stock,$4.65,-0.0519,-1.104%,4854977.00,United States,2021,76709,Health Care,Biotechnology: Pharmaceutical Preparations
KUKE,Kuke Music Holding Limited American Depositary Shares each representing one Ordinary Share,$1.24,-0.06,-4.615%,41232137.00,,2021,18000,Real Estate,Other Consumer Services
KULR,KULR Technology Group Inc. Common Stock,$0.2722,0.0038,1.416%,52531774.00,United States,,1694458,Technology,Electrical Products
KURA,Kura Oncology Inc. Common Stock,$20.18,0.44,2.229%,1546484129.00,United States,,517348,Health Care,Biotechnology: Pharmaceutical Preparations
KVAC,Keen Vision Acquisition Corporation Ordinary Shares,$10.68,0.01,0.094%,0.00,United States,2023,6625,,
KVACU,Keen Vision Acquisition Corporation Units,$10.67,0.00,0.00%,0.00,United States,2023,54,,
KVHI,KVH Industries Inc. Common Stock,$4.62,0.14,3.125%,91079077.00,United States,1996,27556,Technology,Radio And Television Broadcasting And Communications Equipment
KVUE,Kenvue Inc. Common Stock,$21.82,0.26,1.206%,41788951708.00,United States,2023,6785545,Consumer Discretionary,Specialty Chemicals
KVYO,Klaviyo Inc. Series A Common Stock,$32.68,1.10,3.483%,8714865339.00,United States,2023,1392856,Technology,Computer Software: Prepackaged Software
KW,Kennedy-Wilson Holdings Inc. Common Stock,$10.99,0.49,4.667%,1510157034.00,United States,,904294,Finance,Real Estate
KWE,KWESST Micro Systems Inc. Common Stock,$0.16,0.0065,4.235%,1772279.00,Canada,,2806139,Technology,Computer Software: Prepackaged Software
KWR,Quaker Houghton Common Stock,$167.06,3.86,2.365%,2992404614.00,United States,,64440,Industrials,Major Chemicals
KXIN,Kaixin Holdings Ordinary Shares,$0.0828,0.0039,4.943%,4123983.00,China,2017,12003938,Consumer Discretionary,Retail-Auto Dealers and Gas Stations
KYMR,Kymera Therapeutics Inc. Common Stock,$47.78,1.93,4.209%,2950569951.00,United States,2020,709795,Health Care,Biotechnology: Biological Products (No Diagnostic Substances)
KYN,Kayne Anderson Energy Infrastructure Fund Inc.,$10.66,0.18,1.718%,1451162110.00,United States,2004,328290,Finance,Finance/Investors Services
KYTX,Kyverna Therapeutics Inc. Common Stock,$8.09,0.14,1.761%,349058033.00,United States,2024,421885,Health Care,Biotechnology: Biological Products (No Diagnostic Substances)
KZIA,Kazia Therapeutics Limited American Depositary Shares,$0.36,0.0081,2.302%,8209048.00,Australia,,238165,Health Care,Biotechnology: Pharmaceutical Preparations
KZR,Kezar Life Sciences Inc. Common Stock,$0.6287,0.0174,2.846%,45871348.00,United States,2018,258232,Health Care,Biotechnology: Pharmaceutical Preparations
L,Loews Corporation Common Stock,$80.35,0.92,1.158%,17638151739.00,United States,,358226,Finance,Property-Casualty Insurers
LAAC,Lithium Americas (Argentina) Corp. Common Shares,$2.76,0.05,1.845%,441373680.00,Canada,2023,1009608,,
LAB,Standard BioTools Inc. Common Stock,$2.14,0.19,9.744%,794270568.00,United States,2011,2550023,Industrials,Biotechnology: Laboratory Analytical Instruments
LAC,Lithium Americas Corp. Common Shares,$2.72,0.08,3.03%,438736000.00,Canada,2023,3532901,Basic Materials,Metal Mining
LAD,Lithia Motors Inc. Common Stock,$297.61,13.91,4.903%,7958054199.00,United States,,286691,Consumer Discretionary,Retail-Auto Dealers and Gas Stations
LADR,Ladder Capital Corp Class A Common Stock,$12.01,0.21,1.78%,1535671945.00,United States,2014,362517,Real Estate,Real Estate Investment Trusts
LAES,SEALSQ Corp Ordinary Shares,$0.6233,0.0691,12.468%,9627995.00,Switzerland,,1413730,Technology,Semiconductors
LAKE,Lakeland Industries Inc. Common Stock,$24.715,0.245,1.001%,182342698.00,United States,1986,53327,Health Care,Industrial Specialties
LAMR,Lamar Advertising Company Class A Common Stock,$122.19,2.88,2.414%,12500236536.00,United States,1996,249349,Real Estate,Real Estate Investment Trusts
LANC,Lancaster Colony Corporation Common Stock,$173.51,0.28,0.162%,4776209770.00,United States,,317562,Consumer Staples,Packaged Foods
LAND,Gladstone Land Corporation Common Stock,$13.63,0.25,1.868%,488477964.00,United States,1993,181800,Real Estate,Real Estate Investment Trusts
LANDM,Gladstone Land Corporation 5.00% Series D Cumulative Term Preferred Stock,$24.53,-0.02,-0.081%,879116982.00,United States,,339,Real Estate,Real Estate Investment Trusts
LANDO,Gladstone Land Corporation 6.00% Series B Cumulative Redeemable Preferred Stock,$22.33,-0.03,-0.134%,800272410.00,United States,,6829,Real Estate,Real Estate Investment Trusts
LANDP,Gladstone Land Corporation 6.00% Series C Cumulative Redeemable Preferred Stock,$21.05,0.11,0.525%,754399204.00,United States,,28511,Real Estate,Real Estate Investment Trusts
LANV,Lanvin Group Holdings Limited Ordinary Shares,$1.63,0.04,2.516%,213482844.00,Cayman Islands,1996,34716,Finance,Blank Checks
LARK,Landmark Bancorp Inc. Common Stock,$20.19,0.14,0.698%,111093618.00,United States,,2305,Finance,Major Banks
LASE,Laser Photonics Corporation Common Stock,$2.82,-0.06,-2.083%,26142604.00,United States,2022,274241,Miscellaneous,Industrial Machinery/Components
LASR,nLIGHT Inc. Common Stock,$11.68,0.17,1.477%,562107720.00,United States,2018,268998,Technology,Semiconductors
LAUR,Laureate Education Inc. Common Stock,$15.31,0.32,2.135%,2335475708.00,United States,2017,712384,Real Estate,Other Consumer Services
LAW,CS Disco Inc. Common Stock,$5.52,0.29,5.545%,328332018.00,United States,2021,105033,Technology,Computer Software: Prepackaged Software
LAZ,Lazard Inc. Common Stock,$49.88,1.47,3.037%,5624772619.00,Bermuda,2005,615826,Finance,Investment Managers
LAZR,Luminar Technologies Inc.  Class A Common Stock,$1.00,0.0434,4.537%,493760537.00,United States,2019,10241285,Consumer Discretionary,Auto Parts:O.E.M.
LB,LandBridge Company LLC Class A Shares Representing Limited Liability Company Interests,$42.04,2.00,4.995%,3075293390.00,,2024,678947,Energy,Oil & Gas Production
LBPH,Longboard Pharmaceuticals Inc. Common Stock,$34.79,-0.30,-0.855%,1353314336.00,United States,2021,314966,Health Care,Biotechnology: Pharmaceutical Preparations
LBRDA,Liberty Broadband Corporation Class A Common Stock,$60.87,1.61,2.717%,8695155873.00,United States,,79565,Telecommunications,Cable & Other Pay Television Services
LBRDK,Liberty Broadband Corporation Class C Common Stock,$62.13,1.69,2.796%,8875144314.00,United States,,616758,Telecommunications,Cable & Other Pay Television Services
